{
  "name": "Tang v3.3.1 Flame",
  "version": "3.3.1",
  "description": "由 docs/message (1).txt 转换：HA 内核 + 5m MA10/20/30 顺势过滤 + MA30 共振评分 + 0.15% 空间检测 + 普通/Strong 火焰信号 + MA50 灾难止损。",

  "source": {
    "type": "tradingview_pine",
    "pine_version": 5,
    "indicator_title": "小汤系统 V3.3.1 - 极简火焰版",
    "source_file": "docs/message (1).txt",
    "overlay": true
  },

  "candles": {
    "type": "heikin_ashi",
    "fields": {
      "hC": "(open + high + low + close) / 4",
      "hO": "first_bar ? (open + close) / 2 : (prior_hO + prior_hC) / 2",
      "hH": "max(high, hO, hC)",
      "hL": "min(low, hO, hC)"
    },
    "color_rules": {
      "green": "hC > hO",
      "red": "hC < hO"
    }
  },

  "indicators": {
    "moving_averages": {
      "m10": { "type": "sma", "source": "hC", "length": 10, "role": "trigger_line" },
      "m20": { "type": "sma", "source": "hC", "length": 20, "role": "short_defense" },
      "m30": { "type": "sma", "source": "hC", "length": 30, "role": "secondary_defense" },
      "m50": { "type": "sma", "source": "hC", "length": 50, "role": "bull_bear_boundary" },
      "m200": { "type": "sma", "source": "hC", "length": 200, "role": "life_death_line" }
    },
    "vwap": {
      "id": "vw",
      "type": "vwap",
      "source": "hC",
      "role": "institutional_level"
    }
  },

  "trend": {
    "method": "ha_5m_ma_stack",
    "timeframe": "5m",
    "description": "使用 5m Heikin-Ashi close 计算 MA10/MA20/MA30；三线顺势发散才允许对应方向信号。",
    "lines": ["m10", "m20", "m30"],
    "bullish": {
      "m10_above_m20": { "field": "m10_5m", "operator": ">", "target": "m20_5m" },
      "m20_above_m30": { "field": "m20_5m", "operator": ">", "target": "m30_5m" }
    },
    "bearish": {
      "m10_below_m20": { "field": "m10_5m", "operator": "<", "target": "m20_5m" },
      "m20_below_m30": { "field": "m20_5m", "operator": "<", "target": "m30_5m" }
    }
  },

  "multi_timeframe": {
    "primary_bias_tf": "5m",
    "execution_tf": "1m",
    "higher_tf_priority": true,
    "trend_required_for_signal": true,
    "description": "PUT 必须 5m 三线空头排列；CALL 必须 5m 三线多头排列。"
  },

  "confluence": {
    "enabled": true,
    "levels": ["m10", "m20", "m30", "m50", "m200", "vw"],
    "reject_rule": {
      "wick_touch": { "field": "hH", "operator": ">=", "target": "level" },
      "body_below_1": { "field": "hC", "operator": "<=", "target": "level" },
      "body_below_2": { "field": "hO", "operator": "<=", "target": "level" }
    },
    "support_rule": {
      "wick_touch": { "field": "hL", "operator": "<=", "target": "level" },
      "body_above_1": { "field": "hC", "operator": ">=", "target": "level" },
      "body_above_2": { "field": "hO", "operator": ">=", "target": "level" }
    },
    "put_score": "sum(reject_rule over m10,m20,m30,m50,m200,vw)",
    "call_score": "sum(support_rule over m10,m20,m30,m50,m200,vw)",
    "normal_threshold": 1,
    "strong_threshold_min": 2
  },

  "signals": [
    {
      "id": "reject_ma10",
      "name": "Reject MA10",
      "direction": "bearish",
      "style": "red",
      "anchor_side": "top",
      "conditions": {
        "candle_color": "green",
        "wick_touch": { "field": "hH", "operator": ">=", "target": "m10" },
        "body_below_1": { "field": "hC", "operator": "<=", "target": "m10" },
        "body_below_2": { "field": "hO", "operator": "<=", "target": "m10" }
      },
      "confirm": { "next_bar_color": "red" },
      "trend_required": "bearish"
    },
    {
      "id": "support_ma10",
      "name": "Support MA10",
      "direction": "bullish",
      "style": "green",
      "anchor_side": "bottom",
      "conditions": {
        "candle_color": "red",
        "wick_touch": { "field": "hL", "operator": "<=", "target": "m10" },
        "body_above_1": { "field": "hC", "operator": ">=", "target": "m10" },
        "body_above_2": { "field": "hO", "operator": ">=", "target": "m10" }
      },
      "confirm": { "next_bar_color": "green" },
      "trend_required": "bullish"
    },
    {
      "id": "put_normal",
      "name": "Normal PUT",
      "direction": "bearish",
      "style": "red",
      "anchor_side": "top",
      "extends": "reject_ma10",
      "conditions": {
        "prev_bar_signal": "reject_ma10",
        "current_bar_color": "red",
        "trend_5m": "bearish",
        "can_trade": "put",
        "prev_put_score": { "operator": "==", "value": 1 }
      },
      "label": {
        "text": "PUT",
        "size": "small",
        "color": "#c62828",
        "text_color": "#ffffff"
      }
    },
    {
      "id": "put_strong",
      "name": "Strong PUT",
      "direction": "bearish",
      "style": "orange",
      "anchor_side": "top",
      "extends": "reject_ma10",
      "conditions": {
        "prev_bar_signal": "reject_ma10",
        "current_bar_color": "red",
        "trend_5m": "bearish",
        "can_trade": "put",
        "prev_put_score": { "operator": ">=", "value": 2 }
      },
      "label": {
        "text": "Strong PUT",
        "prefix": "flame",
        "size": "normal",
        "color": "#d84315",
        "text_color": "#ffffff"
      }
    },
    {
      "id": "call_normal",
      "name": "Normal CALL",
      "direction": "bullish",
      "style": "green",
      "anchor_side": "bottom",
      "extends": "support_ma10",
      "conditions": {
        "prev_bar_signal": "support_ma10",
        "current_bar_color": "green",
        "trend_5m": "bullish",
        "can_trade": "call",
        "prev_call_score": { "operator": "==", "value": 1 }
      },
      "label": {
        "text": "CALL",
        "size": "small",
        "color": "#2e7d32",
        "text_color": "#ffffff"
      }
    },
    {
      "id": "call_strong",
      "name": "Strong CALL",
      "direction": "bullish",
      "style": "teal",
      "anchor_side": "bottom",
      "extends": "support_ma10",
      "conditions": {
        "prev_bar_signal": "support_ma10",
        "current_bar_color": "green",
        "trend_5m": "bullish",
        "can_trade": "call",
        "prev_call_score": { "operator": ">=", "value": 2 }
      },
      "label": {
        "text": "Strong CALL",
        "prefix": "flame",
        "size": "normal",
        "color": "#00695c",
        "text_color": "#ffffff"
      }
    }
  ],

  "entry_requirements": {
    "pattern_required": true,
    "continuation_confirmation_required": true,
    "confirmation_bar_source": "current_bar_after_prior_pullback",
    "space_check_required": true,
    "space_threshold_pct": 0.15,
    "trend_required": true,
    "not_tangled_required": true,
    "description": "前一根必须在 MA10 形成 pullback/reject，当前 K 线变色确认，同时 5m 顺势、非缠绕、目标方向到 MA50/MA200/VWAP 至少有 0.15% 空间。"
  },

  "space_check": {
    "enabled": true,
    "min_distance_pct_of_price": 0.15,
    "call_barriers_above": ["m50", "m200", "vw"],
    "put_barriers_below": ["m50", "m200", "vw"],
    "call_rule": "min(distance to upper m50/m200/vw) >= hC * 0.0015",
    "put_rule": "min(distance to lower m50/m200/vw) >= hC * 0.0015"
  },

  "scoring": {
    "enabled": true,
    "type": "multi_level_confluence",
    "dimensions": {
      "ma10_confluence": { "max": 1, "desc": "MA10 reject/support" },
      "ma20_confluence": { "max": 1, "desc": "MA20 reject/support" },
      "ma30_confluence": { "max": 1, "desc": "MA30 reject/support" },
      "ma50_confluence": { "max": 1, "desc": "MA50 reject/support" },
      "ma200_confluence": { "max": 1, "desc": "MA200 reject/support" },
      "vwap_confluence": { "max": 1, "desc": "VWAP reject/support" }
    },
    "normal_signal_score": 1,
    "strong_signal_score_min": 2,
    "max_total": 6
  },

  "position_state": {
    "enabled": true,
    "virtual_position": true,
    "set_short_on": "signal_put_base",
    "set_long_on": "signal_call_base",
    "reset_on_stop": true
  },

  "exit": {
    "_comment": "Pine 版本只实现了 MA50 灾难防线，没有实现固定止盈、时间止损或 trailing。",
    "L1_technical": {
      "tp_bars": 0,
      "time_stop_bars": 0,
      "ma_stop_line": "m50"
    },
    "L2_hard_stops": {
      "catastrophic_ma50_body_cross": true,
      "put_stop": {
        "hC_above_m50": { "field": "hC", "operator": ">", "target": "m50" },
        "hO_below_m50": { "field": "hO", "operator": "<", "target": "m50" }
      },
      "call_stop": {
        "hC_below_m50": { "field": "hC", "operator": "<", "target": "m50" },
        "hO_above_m50": { "field": "hO", "operator": ">", "target": "m50" }
      }
    },
    "L3_trailing": {
      "enabled": false
    }
  },

  "filter": {
    "min_score": null,
    "session": {
      "start": "09:30",
      "end": null,
      "timezone": "America/New_York",
      "source_note": "Pine 变量名为 is_after_10am，但表达式实际允许 09:30 以后。"
    },
    "entangle_threshold": 0.03,
    "entangle_threshold_ratio": 0.0003,
    "entangle_lines": ["m10", "m20", "m30", "m50"],
    "space_threshold": 0.15,
    "space_threshold_ratio": 0.0015
  },

  "hard_blocks": {
    "no_trend": true,
    "entangle": true,
    "no_space": true,
    "mtf_conflict": true,
    "before_session_start": true
  },

  "alerts": [
    {
      "id": "normal_signal",
      "when": ["put_normal", "call_normal"],
      "title": "Normal Signal",
      "message": "1m Reject/Support confirmed."
    },
    {
      "id": "strong_signal",
      "when": ["put_strong", "call_strong"],
      "title": "Strong Signal",
      "message": "Multi-MA Confluence detected! Strong setup."
    },
    {
      "id": "stop",
      "when": ["is_sl_triggered"],
      "title": "STOP",
      "message": "MA50 broken. Exit position immediately."
    }
  ],

  "options": {
    "default_iv": 0.22,
    "risk_free_rate": 0.045,
    "dte_mode": "auto",
    "dte_auto_switch": "14:00",
    "strike_method": "atm"
  }
}
